{
  "schemaVersion": "cotsel.candidate-manifest.v2",
  "candidateId": "cotsel-2026-08-05-fixture",
  "status": "candidate",
  "owner": {
    "role": "Release Owner"
  },
  "createdAt": "2026-08-05T09:00:00.000Z",
  "environment": {
    "name": "base-sepolia-staging",
    "classification": "private-staging",
    "owner": "Platform Operations",
    "publicParticipants": false,
    "realCommercialValue": false
  },
  "source": {
    "repository": "Agroasys/Cotsel",
    "commit": "8b4a693eb4cff3fe62605f2d10435f895afebb78",
    "workflowRunId": "fixture-run-1"
  },
  "crossRepositoryManifest": {
    "path": "integration/release-manifest.json",
    "schemaVersion": "cotsel.release-manifest.v1",
    "sha256": "109fd744249f794dfa27017a507724562b878107d112d53abb658326ca4366eb"
  },
  "artifacts": [
    {
      "name": "auth",
      "kind": "container-image",
      "digest": "sha256:1111111111111111111111111111111111111111111111111111111111111111",
      "reference": "example.invalid/cotsel/auth@sha256:1111111111111111111111111111111111111111111111111111111111111111",
      "sourceRepository": "Agroasys/Cotsel",
      "sourceCommit": "8b4a693eb4cff3fe62605f2d10435f895afebb78",
      "producingWorkflow": ".github/workflows/release-images.yml",
      "producingRunId": "fixture-auth",
      "provenance": {
        "uri": "https://evidence.invalid/auth/provenance",
        "sha256": "f111111111111111111111111111111111111111111111111111111111111111",
        "verified": true
      },
      "sbom": {
        "required": true,
        "uri": "https://evidence.invalid/auth/sbom",
        "sha256": "0111111111111111111111111111111111111111111111111111111111111111",
        "verified": true
      },
      "verificationStatus": "verified"
    },
    {
      "name": "gateway",
      "kind": "container-image",
      "digest": "sha256:2222222222222222222222222222222222222222222222222222222222222222",
      "reference": "example.invalid/cotsel/gateway@sha256:2222222222222222222222222222222222222222222222222222222222222222",
      "sourceRepository": "Agroasys/Cotsel",
      "sourceCommit": "8b4a693eb4cff3fe62605f2d10435f895afebb78",
      "producingWorkflow": ".github/workflows/release-images.yml",
      "producingRunId": "fixture-gateway",
      "provenance": {
        "uri": "https://evidence.invalid/gateway/provenance",
        "sha256": "f222222222222222222222222222222222222222222222222222222222222222",
        "verified": true
      },
      "sbom": {
        "required": true,
        "uri": "https://evidence.invalid/gateway/sbom",
        "sha256": "0222222222222222222222222222222222222222222222222222222222222222",
        "verified": true
      },
      "verificationStatus": "verified"
    },
    {
      "name": "indexer-graphql",
      "kind": "container-image",
      "digest": "sha256:3333333333333333333333333333333333333333333333333333333333333333",
      "reference": "example.invalid/cotsel/indexer-graphql@sha256:3333333333333333333333333333333333333333333333333333333333333333",
      "sourceRepository": "Agroasys/Cotsel",
      "sourceCommit": "8b4a693eb4cff3fe62605f2d10435f895afebb78",
      "producingWorkflow": ".github/workflows/release-images.yml",
      "producingRunId": "fixture-indexer-graphql",
      "provenance": {
        "uri": "https://evidence.invalid/indexer-graphql/provenance",
        "sha256": "f333333333333333333333333333333333333333333333333333333333333333",
        "verified": true
      },
      "sbom": {
        "required": true,
        "uri": "https://evidence.invalid/indexer-graphql/sbom",
        "sha256": "0333333333333333333333333333333333333333333333333333333333333333",
        "verified": true
      },
      "verificationStatus": "verified"
    },
    {
      "name": "indexer-pipeline",
      "kind": "container-image",
      "digest": "sha256:4444444444444444444444444444444444444444444444444444444444444444",
      "reference": "example.invalid/cotsel/indexer-pipeline@sha256:4444444444444444444444444444444444444444444444444444444444444444",
      "sourceRepository": "Agroasys/Cotsel",
      "sourceCommit": "8b4a693eb4cff3fe62605f2d10435f895afebb78",
      "producingWorkflow": ".github/workflows/release-images.yml",
      "producingRunId": "fixture-indexer-pipeline",
      "provenance": {
        "uri": "https://evidence.invalid/indexer-pipeline/provenance",
        "sha256": "f444444444444444444444444444444444444444444444444444444444444444",
        "verified": true
      },
      "sbom": {
        "required": true,
        "uri": "https://evidence.invalid/indexer-pipeline/sbom",
        "sha256": "0444444444444444444444444444444444444444444444444444444444444444",
        "verified": true
      },
      "verificationStatus": "verified"
    },
    {
      "name": "oracle",
      "kind": "container-image",
      "digest": "sha256:5555555555555555555555555555555555555555555555555555555555555555",
      "reference": "example.invalid/cotsel/oracle@sha256:5555555555555555555555555555555555555555555555555555555555555555",
      "sourceRepository": "Agroasys/Cotsel",
      "sourceCommit": "8b4a693eb4cff3fe62605f2d10435f895afebb78",
      "producingWorkflow": ".github/workflows/release-images.yml",
      "producingRunId": "fixture-oracle",
      "provenance": {
        "uri": "https://evidence.invalid/oracle/provenance",
        "sha256": "f555555555555555555555555555555555555555555555555555555555555555",
        "verified": true
      },
      "sbom": {
        "required": true,
        "uri": "https://evidence.invalid/oracle/sbom",
        "sha256": "0555555555555555555555555555555555555555555555555555555555555555",
        "verified": true
      },
      "verificationStatus": "verified"
    },
    {
      "name": "reconciliation",
      "kind": "container-image",
      "digest": "sha256:6666666666666666666666666666666666666666666666666666666666666666",
      "reference": "example.invalid/cotsel/reconciliation@sha256:6666666666666666666666666666666666666666666666666666666666666666",
      "sourceRepository": "Agroasys/Cotsel",
      "sourceCommit": "8b4a693eb4cff3fe62605f2d10435f895afebb78",
      "producingWorkflow": ".github/workflows/release-images.yml",
      "producingRunId": "fixture-reconciliation",
      "provenance": {
        "uri": "https://evidence.invalid/reconciliation/provenance",
        "sha256": "f666666666666666666666666666666666666666666666666666666666666666",
        "verified": true
      },
      "sbom": {
        "required": true,
        "uri": "https://evidence.invalid/reconciliation/sbom",
        "sha256": "0666666666666666666666666666666666666666666666666666666666666666",
        "verified": true
      },
      "verificationStatus": "verified"
    },
    {
      "name": "relayer",
      "kind": "container-image",
      "digest": "sha256:7777777777777777777777777777777777777777777777777777777777777777",
      "reference": "example.invalid/cotsel/relayer@sha256:7777777777777777777777777777777777777777777777777777777777777777",
      "sourceRepository": "Agroasys/Cotsel",
      "sourceCommit": "8b4a693eb4cff3fe62605f2d10435f895afebb78",
      "producingWorkflow": ".github/workflows/release-images.yml",
      "producingRunId": "fixture-relayer",
      "provenance": {
        "uri": "https://evidence.invalid/relayer/provenance",
        "sha256": "f777777777777777777777777777777777777777777777777777777777777777",
        "verified": true
      },
      "sbom": {
        "required": true,
        "uri": "https://evidence.invalid/relayer/sbom",
        "sha256": "0777777777777777777777777777777777777777777777777777777777777777",
        "verified": true
      },
      "verificationStatus": "verified"
    },
    {
      "name": "ricardian",
      "kind": "container-image",
      "digest": "sha256:8888888888888888888888888888888888888888888888888888888888888888",
      "reference": "example.invalid/cotsel/ricardian@sha256:8888888888888888888888888888888888888888888888888888888888888888",
      "sourceRepository": "Agroasys/Cotsel",
      "sourceCommit": "8b4a693eb4cff3fe62605f2d10435f895afebb78",
      "producingWorkflow": ".github/workflows/release-images.yml",
      "producingRunId": "fixture-ricardian",
      "provenance": {
        "uri": "https://evidence.invalid/ricardian/provenance",
        "sha256": "f888888888888888888888888888888888888888888888888888888888888888",
        "verified": true
      },
      "sbom": {
        "required": true,
        "uri": "https://evidence.invalid/ricardian/sbom",
        "sha256": "0888888888888888888888888888888888888888888888888888888888888888",
        "verified": true
      },
      "verificationStatus": "verified"
    },
    {
      "name": "treasury",
      "kind": "container-image",
      "digest": "sha256:9999999999999999999999999999999999999999999999999999999999999999",
      "reference": "example.invalid/cotsel/treasury@sha256:9999999999999999999999999999999999999999999999999999999999999999",
      "sourceRepository": "Agroasys/Cotsel",
      "sourceCommit": "8b4a693eb4cff3fe62605f2d10435f895afebb78",
      "producingWorkflow": ".github/workflows/release-images.yml",
      "producingRunId": "fixture-treasury",
      "provenance": {
        "uri": "https://evidence.invalid/treasury/provenance",
        "sha256": "f999999999999999999999999999999999999999999999999999999999999999",
        "verified": true
      },
      "sbom": {
        "required": true,
        "uri": "https://evidence.invalid/treasury/sbom",
        "sha256": "0999999999999999999999999999999999999999999999999999999999999999",
        "verified": true
      },
      "verificationStatus": "verified"
    },
    {
      "name": "@agroasys/sdk",
      "kind": "npm-package",
      "digest": "sha256:aaaaaaaaaaaaaaaaaaaaaaaaaaaaaaaaaaaaaaaaaaaaaaaaaaaaaaaaaaaaaaaa",
      "sourceRepository": "Agroasys/Cotsel",
      "sourceCommit": "8b4a693eb4cff3fe62605f2d10435f895afebb78",
      "producingWorkflow": ".github/workflows/sdk-publish.yml",